{"$id":"https://offdata.local/schemas/pcfa05-minimum-valuable-consulting-loop.schema.json","$schema":"https://json-schema.org/draft/2020-12/schema","additionalProperties":false,"properties":{"boundaries":{"additionalProperties":{"type":"boolean"},"required":["founder_accountability_preserved","codex_start_authorized","phase0_implementation_authorized","phase0_merge_authorized","phase1_authorized","merge_authorized","runtime_activation_authorized","hermes_activation_authorized","real_client_data_enabled","external_actions_authorized","paid_services_authorized","oauth_authorized","production_deployment_authorized","autonomous_merge_authorized"],"type":"object"},"contract_id":{"const":"MINIMUM-VALUABLE-CONSULTING-LOOP"},"founder_interrupts":{"items":{"additionalProperties":false,"properties":{"interrupt_id":{"pattern":"^MVCL-FI-0[1-6]$","type":"string"},"permitted_outcomes":{"items":{"minLength":1,"type":"string"},"minItems":1,"type":"array","uniqueItems":true},"stage_ids":{"items":{"pattern":"^MVCL-(?:0[1-9]|1[0-9])$","type":"string"},"minItems":1,"type":"array","uniqueItems":true},"trigger":{"minLength":1,"type":"string"}},"required":["interrupt_id","trigger","stage_ids","permitted_outcomes"],"type":"object"},"maxItems":6,"minItems":6,"type":"array"},"generated_from":{"const":"configs/pcfa05-minimum-valuable-consulting-loop.yaml"},"loop_invariants":{"items":{"additionalProperties":false,"properties":{"id":{"pattern":"^MVCL-INV-[A-Z0-9-]+$","type":"string"},"statement":{"minLength":1,"type":"string"}},"required":["id","statement"],"type":"object"},"maxItems":15,"minItems":15,"type":"array"},"negative_cases":{"items":{"additionalProperties":false,"properties":{"case_id":{"pattern":"^MVCL-NEG-(?:0[1-9]|1[0-3])$","type":"string"},"expected":{"minLength":1,"type":"string"},"name":{"minLength":1,"type":"string"}},"required":["case_id","name","expected"],"type":"object"},"maxItems":13,"minItems":13,"type":"array"},"owner":{"const":"Founder"},"pcfa07_reconciliation_contract":{"additionalProperties":{"const":true},"minProperties":8,"type":"object"},"repository":{"const":"rayrayxing/offdata-os"},"schema_version":{"const":"1.0.0"},"scope_boundary":{"additionalProperties":false,"properties":{"canonical_state_mutation_implemented":{"const":false},"codex_start_authorized":{"const":false},"imp_phase_scope_widened":{"const":false},"pcfa07_registry_reconciliation_required":{"const":true},"pcfa08_final_acceptance_required":{"const":true},"product_runtime_implemented":{"const":false},"specification_only":{"const":true},"workflow_runtime_implemented":{"const":false}},"required":["specification_only","product_runtime_implemented","workflow_runtime_implemented","canonical_state_mutation_implemented","imp_phase_scope_widened","codex_start_authorized","pcfa07_registry_reconciliation_required","pcfa08_final_acceptance_required"],"type":"object"},"stages":{"items":{"additionalProperties":false,"properties":{"canonical_outputs":{"items":{"minLength":1,"type":"string"},"minItems":1,"type":"array","uniqueItems":true},"founder_gate":{"minLength":1,"type":"string"},"integration_points":{"items":{"pattern":"^P(?:[1-9]|1[0-2])\\.[1-9][0-9]*$","type":"string"},"minItems":1,"type":"array","uniqueItems":true},"name":{"minLength":1,"type":"string"},"owning_imp_phases":{"items":{"pattern":"^IMP-P(?:[1-9]|1[0-2])$","type":"string"},"minItems":1,"type":"array","uniqueItems":true},"purpose":{"minLength":1,"type":"string"},"stage_id":{"pattern":"^MVCL-(?:0[1-9]|1[0-9])$","type":"string"},"status":{"const":"planned_not_implemented"}},"required":["stage_id","name","purpose","canonical_outputs","owning_imp_phases","integration_points","founder_gate","status"],"type":"object"},"maxItems":19,"minItems":19,"type":"array"},"status":{"const":"repository_specification_complete_planned_not_implemented"},"title":{"const":"Minimum Valuable Consulting Loop"},"transition_policy":{"additionalProperties":false,"properties":{"blocking_defect_prohibits_release":{"const":true},"duplicate_effects_prohibited":{"const":true},"forward_sequence_required":{"const":true},"founder_cancel_prohibits_further_execution":{"const":true},"pause_resume_requires_durable_checkpoint":{"const":true},"recycle_requires_reason_and_audit_record":{"const":true},"recycle_to_affected_prior_stage_allowed":{"const":true},"stage_skipping_default":{"const":false},"stale_approval_prohibits_resume":{"const":true},"terminal_states":{"items":{"enum":["completed","cancelled","blocked","paused"]},"maxItems":4,"minItems":4,"type":"array","uniqueItems":true}},"required":["forward_sequence_required","stage_skipping_default","recycle_to_affected_prior_stage_allowed","recycle_requires_reason_and_audit_record","pause_resume_requires_durable_checkpoint","founder_cancel_prohibits_further_execution","blocking_defect_prohibits_release","stale_approval_prohibits_resume","duplicate_effects_prohibited","terminal_states"],"type":"object"},"truth_chain":{"items":{"minLength":1,"type":"string"},"maxItems":19,"minItems":19,"type":"array","uniqueItems":true},"work_package_id":{"const":"PCFA-05"}},"required":["schema_version","work_package_id","contract_id","title","repository","status","owner","generated_from","scope_boundary","truth_chain","loop_invariants","stages","founder_interrupts","transition_policy","negative_cases","pcfa07_reconciliation_contract","boundaries"],"title":"offdata PCFA-05 Minimum Valuable Consulting Loop","type":"object"}
