{"boundaries":{"autonomous_merge_authorized":false,"codex_start_authorized":false,"external_actions_authorized":false,"founder_accountability_preserved":true,"hermes_activation_authorized":false,"merge_authorized":false,"oauth_authorized":false,"paid_services_authorized":false,"phase0_implementation_authorized":false,"phase0_merge_authorized":false,"phase1_authorized":false,"production_deployment_authorized":false,"real_client_data_enabled":false,"runtime_activation_authorized":false},"contract_id":"MINIMUM-VALUABLE-CONSULTING-LOOP","founder_interrupts":[{"interrupt_id":"MVCL-FI-01","permitted_outcomes":["approve","reject","recycle","pause","stop"],"stage_ids":["MVCL-02"],"trigger":"material_mandate_or_scope_commitment"},{"interrupt_id":"MVCL-FI-02","permitted_outcomes":["approve_exception","reject","recycle","pause","stop"],"stage_ids":["MVCL-06","MVCL-07","MVCL-09","MVCL-10","MVCL-11","MVCL-12"],"trigger":"material_evidence_method_risk_or_external_access_exception"},{"interrupt_id":"MVCL-FI-03","permitted_outcomes":["approve","reject","recycle","pause","stop"],"stage_ids":["MVCL-13"],"trigger":"recommendation_decision"},{"interrupt_id":"MVCL-FI-04","permitted_outcomes":["approve_release","reject_release","recycle","pause","stop"],"stage_ids":["MVCL-16"],"trigger":"artefact_release_after_independent_qa"},{"interrupt_id":"MVCL-FI-05","permitted_outcomes":["scale","adapt","stop","continue_measurement","recycle"],"stage_ids":["MVCL-18"],"trigger":"benefit_scale_adapt_stop_decision"},{"interrupt_id":"MVCL-FI-06","permitted_outcomes":["recycle","pause","cancel","stop"],"stage_ids":["MVCL-01","MVCL-02","MVCL-03","MVCL-04","MVCL-05","MVCL-06","MVCL-07","MVCL-08","MVCL-09","MVCL-10","MVCL-11","MVCL-12","MVCL-13","MVCL-14","MVCL-15","MVCL-16","MVCL-17","MVCL-18","MVCL-19"],"trigger":"founder_discretionary_control"}],"generated_from":"configs/pcfa05-minimum-valuable-consulting-loop.yaml","loop_invariants":[{"id":"MVCL-INV-ENGAGEMENT-ID","statement":"One stable engagement ID spans the consulting loop and all derived records."},{"id":"MVCL-INV-CANONICAL-STATE","statement":"Canonical engagement truth lives only in governed system-of-record state; chat, model and runtime memory are noncanonical."},{"id":"MVCL-INV-CLAIM-TRACE","statement":"Every material claim traces to source evidence, a named deterministic analysis, or an explicitly approved assumption."},{"id":"MVCL-INV-NUMBER-REPRO","statement":"Every material number is reproducible from governed inputs, formulas, code, model version and run metadata."},{"id":"MVCL-INV-CONTRARY-EVIDENCE","statement":"Material contradicting evidence, evidence gaps and falsifiers are retained rather than suppressed."},{"id":"MVCL-INV-METHOD-JUSTIFICATION","statement":"Method selection records the decision need, evidence burden, selected method stack and material rejected alternatives."},{"id":"MVCL-INV-IDEMPOTENCY","statement":"Retried or replayed commands and external-effect requests cannot create duplicate canonical effects."},{"id":"MVCL-INV-EXACT-APPROVAL","statement":"Founder approval binds the exact version, decision, action and scope being approved and becomes stale when those inputs change."},{"id":"MVCL-INV-RESTART-SAFE","statement":"Durable checkpoints allow restart from the latest committed state without losing history or duplicating completed effects."},{"id":"MVCL-INV-INDEPENDENT-QA","statement":"Material work is reviewed independently from the creator context before release or a material Founder decision."},{"id":"MVCL-INV-CROSS-FORMAT","statement":"PPTX, DOCX, XLSX, PDF, SVG and HTML outputs reconcile to the same approved story, claims and numbers where applicable."},{"id":"MVCL-INV-REC-TO-BENEFIT","statement":"Implementation initiatives and benefits trace to an approved recommendation, baseline, owner and verification method."},{"id":"MVCL-INV-AUDIT-HISTORY","statement":"Material commands, events, approvals, defects, versions, agent/tool actions and releases remain auditable."},{"id":"MVCL-INV-FOUNDER-CONTROL","statement":"The Founder can approve, recycle, pause, cancel or stop material work without losing completed evidence or governance history."},{"id":"MVCL-INV-NO-SELF-APPROVAL","statement":"No agent, worker, model or creator context can be the sole approver of its own material work."}],"negative_cases":[{"case_id":"MVCL-NEG-01","expected":"block_claim_or_recommendation_and_record_gap","name":"missing_material_evidence"},{"case_id":"MVCL-NEG-02","expected":"retain_contradiction_reassess_confidence_and_prevent_silent_override","name":"material_contradicting_evidence"},{"case_id":"MVCL-NEG-03","expected":"checkpoint_and_block_until_exact_scoped_approval","name":"approval_wait"},{"case_id":"MVCL-NEG-04","expected":"invalidate_approval_and_require_new_founder_decision","name":"stale_approval_after_material_change"},{"case_id":"MVCL-NEG-05","expected":"resume_without_duplicate_effect_or_lost_history","name":"restart_after_checkpoint"},{"case_id":"MVCL-NEG-06","expected":"preserve_single_canonical_effect_and_record_idempotent_replay","name":"duplicate_command_or_action"},{"case_id":"MVCL-NEG-07","expected":"transition_to_cancelled_and_prohibit_further_execution","name":"founder_cancellation"},{"case_id":"MVCL-NEG-08","expected":"prohibit_release_recycle_to_affected_stage_repair_and_retest","name":"blocking_qa_defect"},{"case_id":"MVCL-NEG-09","expected":"deny_access_and_preserve_tenant_and_engagement_isolation","name":"cross_engagement_access_attempt"},{"case_id":"MVCL-NEG-10","expected":"quarantine_or_neutralise_instructions_while_preserving_source_evidence","name":"malicious_or_instruction_bearing_document"},{"case_id":"MVCL-NEG-11","expected":"fail_closed_or_use_declared_fallback_without_mutating_canonical_truth","name":"provider_or_agent_runtime_failure"},{"case_id":"MVCL-NEG-12","expected":"block_dependent_claims_deliverables_and_release_until_recalculated","name":"numeric_or_formula_defect"},{"case_id":"MVCL-NEG-13","expected":"block_release_preserve_semantic_source_and_regenerate_after_repair","name":"renderer_or_cross_format_reconciliation_defect"}],"owner":"Founder","pcfa07_reconciliation_contract":{"every_invariant_must_receive_planned_test_ids":true,"every_negative_case_must_receive_planned_test_ids":true,"every_stage_must_receive_blocking_phase_gate":true,"every_stage_must_receive_dependencies":true,"every_stage_must_receive_evidence_types":true,"every_stage_must_receive_exact_task_bindings":true,"every_stage_must_receive_planned_test_ids":true,"status_must_remain_planned_not_implemented_until_codex_evidence":true},"repository":"rayrayxing/offdata-os","schema_version":"1.0.0","scope_boundary":{"canonical_state_mutation_implemented":false,"codex_start_authorized":false,"imp_phase_scope_widened":false,"pcfa07_registry_reconciliation_required":true,"pcfa08_final_acceptance_required":true,"product_runtime_implemented":false,"specification_only":true,"workflow_runtime_implemented":false},"stages":[{"canonical_outputs":["opportunity_record","source_context","fit_and_value_hypothesis","relationship_continuity"],"founder_gate":"material_commitment_only","integration_points":["P2.2","P8.4","P9.2","P9.3"],"name":"opportunity","owning_imp_phases":["IMP-P2","IMP-P8","IMP-P9"],"purpose":"Establish a governed opportunity or internal consulting need before substantive work begins.","stage_id":"MVCL-01","status":"planned_not_implemented"},{"canonical_outputs":["mandate_packet","governing_decision","decision_owner","scope","constraints","evidence_standard","gaps"],"founder_gate":"required_for_material_mandate","integration_points":["P2.2","P2.4","P4.1","P5.1"],"name":"mandate","owning_imp_phases":["IMP-P2","IMP-P4","IMP-P5"],"purpose":"Convert available context into a decision-oriented mandate with scope, constraints, evidence burden and material gaps.","stage_id":"MVCL-02","status":"planned_not_implemented"},{"canonical_outputs":["engagement_record","tenant_boundary","lifecycle_instance","accountable_founder"],"founder_gate":"none","integration_points":["P2.1","P2.2","P3.1","P3.2"],"name":"engagement","owning_imp_phases":["IMP-P2","IMP-P3"],"purpose":"Instantiate the engagement identity, tenancy, lifecycle and governed operating workspace without creating parallel state.","stage_id":"MVCL-03","status":"planned_not_implemented"},{"canonical_outputs":["decision_frame","decision_questions","criteria","uncertainties","units_of_analysis"],"founder_gate":"material_frame_change_only","integration_points":["P2.2","P4.1","P4.2","P4.4"],"name":"decision_framing","owning_imp_phases":["IMP-P2","IMP-P4"],"purpose":"Translate the mandate into explicit decision questions, decision criteria, uncertainties and units of analysis.","stage_id":"MVCL-04","status":"planned_not_implemented"},{"canonical_outputs":["issue_tree","hypotheses","rival_explanations","falsifiers","evidence_needs"],"founder_gate":"none","integration_points":["P4.2","P4.4","P5.1"],"name":"hypothesis_tree","owning_imp_phases":["IMP-P4","IMP-P5"],"purpose":"Form a testable issue architecture with rival explanations, falsifiers and evidence needs.","stage_id":"MVCL-05","status":"planned_not_implemented"},{"canonical_outputs":["research_plan","source_strategy","stopping_criteria","access_scope","evidence_quality_plan"],"founder_gate":"material_external_access_only","integration_points":["P5.1"],"name":"research_plan","owning_imp_phases":["IMP-P5"],"purpose":"Define source strategy, research questions, stopping criteria, access boundaries and evidence-quality expectations.","stage_id":"MVCL-06","status":"planned_not_implemented"},{"canonical_outputs":["source_records","evidence_records","provenance_locators","source_versions","quarantine_records"],"founder_gate":"restricted_source_exception_only","integration_points":["P1.1","P1.2","P5.2","P5.4","P11.3"],"name":"evidence","owning_imp_phases":["IMP-P1","IMP-P5","IMP-P11"],"purpose":"Acquire and preserve governed source material with provenance, access controls, versioning and malici